{
  "schemaVersion": 1,
  "receiptId": "receipt-jira-execution-mode-update-duplicate",
  "decisionId": "decision-jira-execution-mode-update",
  "eventId": "evt-jira-execution-mode-update",
  "destination": "jira",
  "idempotencyKey": "evt-jira-execution-mode-update:jira:update:AEPI-10",
  "outcome": "already-applied",
  "stateChanged": false,
  "originalReceiptId": "receipt-jira-execution-mode-update-first",
  "resultRef": "jira:AEPI-10",
  "observedAt": "2026-07-24T20:10:03Z"
}
