{
  "schemaVersion": 1,
  "receiptId": "receipt-jira-status-reminder-2",
  "decisionId": "decision-jira-status-reminder-2",
  "eventId": "evt-jira-status-reminder-2",
  "destination": "jira",
  "idempotencyKey": "evt-jira-status-reminder-2:jira:append:AEPI-10-comments",
  "outcome": "suppressed",
  "stateChanged": false,
  "resultRef": "receipt:receipt-jira-status-reminder-1",
  "observedAt": "2026-07-24T20:20:07Z"
}
